{
 "scheme": "qorb-seal-v1",
 "path": "quantumorb/db.py",
 "commitment": "e3d46edff1b0ccc9bf1c735d8274301ee8d854bbbbd90e88c162645f978beac2",
 "leaf": "16f1448ec7d3faadbecf6d41dfbf2e7778b682293db968bd6c5f0f6a31268515",
 "proof": [
  [
   "L",
   "1c802f1307fb498a1b1fd7f2bb8cd268b42cb8de93b9cb5351aa2ceb271c5944"
  ],
  [
   "R",
   "96344619d27fdb356c82e79ddf3fa42566f08334b7c2adb82ff499ba8f9d33a0"
  ],
  [
   "R",
   "c75ab3acbec13e56edcc22ed2d15837baa3eff221d46ff93c823dce7c7e5df7f"
  ],
  [
   "R",
   "7c97eb6a5cbcd775ac762121740731370c1bdd23ff8a643c3bbc617e4087a676"
  ],
  [
   "R",
   "3d7ddea9a8fe44e043b7a766f80ce9bce0d31219fc1e8d23f6150b759d09ecb9"
  ],
  [
   "R",
   "5de5a4a31514007034991c155b2fae18d3f5e60df01b7f537a305a971642d8bb"
  ],
  [
   "L",
   "251139cc1e592011928d2a3565a4d85f224a8ceb5b6071d9db230fb432b0213c"
  ],
  [
   "R",
   "5312c0c171520841653c6ddf51c83f0b69568b444f52f30b282dafd5b2742ca3"
  ]
 ],
 "root": "8dd6c93e05b537f1972771a8f1aff150c3d83db4a7dc67cff276e0e8bf131af8"
}
