{
 "scheme": "qorb-seal-v1",
 "path": "quantumorb/pipeline/guard.py",
 "commitment": "843e7eae6b33eedce57cb3ddc95ecbbd3366bd2f9572d48681eaf62d30b542dc",
 "leaf": "ff0ab96ab8e2464fb22be41ec2b725838826ec0b8c84409de2820994c96f6f5d",
 "proof": [
  [
   "R",
   "f939eb05212feca4abe2fe60d741599fe2b29c81b3b8bea8d98efc1dcabff3fa"
  ],
  [
   "L",
   "939e0b5dfd377eebd8b5173f71efdf94a5b1a5e38f253dc7e28e72882235eada"
  ],
  [
   "L",
   "dca7afd92dfbbdeb59adce5f6689b514acc326d759c95ecd0b6cb7eeabde8311"
  ],
  [
   "R",
   "7c97eb6a5cbcd775ac762121740731370c1bdd23ff8a643c3bbc617e4087a676"
  ],
  [
   "R",
   "60a06562525c6fa362e487ec85fcbd2f6c3fa1ad6c3b6dee680b0b42184a3dbf"
  ],
  [
   "R",
   "5de5a4a31514007034991c155b2fae18d3f5e60df01b7f537a305a971642d8bb"
  ],
  [
   "L",
   "36ed894c745c99007658439d10057b5c61986358c6ed9e2de29a4a1d59b793c5"
  ],
  [
   "R",
   "5312c0c171520841653c6ddf51c83f0b69568b444f52f30b282dafd5b2742ca3"
  ]
 ],
 "root": "145d2c1fd7991bcc1fd384d447ef1424d49230ca639d9e3909e2bed053fa1c95"
}
